<?xml version="1.0" encoding="UTF-8" standalone="no"?> 
<xs:schema xmlns:xs="http://www.w3.org/2001/XMLSchema">
    <xs:element name="Usuarios">
        <xs:complexType>
            <xs:sequence>
                <xs:element name="Usuario" maxOccurs="unbounded">
                    <xs:complexType>
                        <xs:sequence>
                            <xs:element name="Nombre" type="xs:string"/>
                        </xs:sequence>
                        <xs:attribute name="id" use="required">
                            <xs:simpleType>
                                <xs:restriction base="xs:positiveInteger">
                                    <xs:minInclusive value="1"/>
                                </xs:restriction>
                            </xs:simpleType> 
                        </xs:attribute>
                    </xs:complexType>
                </xs:element>
            </xs:sequence>
        </xs:complexType>
    </xs:element>
</xs:schema>